{
  "apiVersion": "skills.dev/v1",
  "kind": "Skill",
  "identity": {
    "id": "product/feedback-cluster",
    "name": "Feedback Clusterer",
    "version": "1.0.0",
    "description": "Groups free-text product feedback into themed clusters with representative examples.",
    "owner": {
      "handle": "p.adeyemi",
      "team": "Product"
    },
    "skillType": "mcp-tool",
    "tags": [
      "product",
      "feedback",
      "clustering"
    ]
  },
  "capability": {
    "summary": "Cluster free-text product feedback into themes",
    "capabilityTags": [
      "product.feedback.cluster"
    ],
    "inputs": [
      {
        "name": "feedback",
        "type": "FeedbackBatch",
        "required": true
      }
    ],
    "outputs": [
      {
        "name": "clusters",
        "type": "ThemeClusters",
        "required": true
      }
    ],
    "preconditions": [],
    "effects": []
  },
  "scoring": {
    "determinism": "medium",
    "risk": "low",
    "reversible": true,
    "rationale": "Model-backed clustering; advisory grouping for human review."
  },
  "dependencies": [],
  "governance": {
    "visibility": "org",
    "rbac": [
      "product.manager"
    ],
    "dataClassification": "internal",
    "cost": {
      "unit": "tokens-per-call",
      "estimate": 0.0
    },
    "audit": {
      "logged": true,
      "retentionDays": 180
    }
  },
  "lifecycle": {
    "stage": "published",
    "certifiedBy": "coe.reviewer",
    "certifiedAt": "2026-06-01T09:00:00Z"
  }
}
