{
  "apiVersion": "skills.dev/v1",
  "kind": "Skill",
  "identity": {
    "id": "design/theme-factory",
    "name": "Theme Factory",
    "version": "1.0.0",
    "description": "Produces a consistent UI theme (colour ramp, type scale, spacing, radii) from a small input: brand name, vibe words, primary colour. Returns design-token JSON usable by Tailwind, MUI or raw CSS variables. Originally an Anthropic Agent Skill.",
    "owner": {
      "handle": "anthropics",
      "team": "Anthropic Skills",
      "contact": "skills@example.com"
    },
    "skillType": "anthropic-agent-skill",
    "tags": ["design", "theme", "tokens", "ui", "branding"]
  },
  "capability": {
    "summary": "Generate a coherent UI theme as design tokens",
    "capabilityTags": ["theme.generate", "design.tokens", "branding.palette"],
    "inputs": [
      { "name": "brief", "type": "ThemeBrief", "required": true, "description": "Brand name, vibe words, primary colour (hex)." }
    ],
    "outputs": [
      { "name": "tokens", "type": "DesignTokens", "required": true, "description": "JSON design-token document." },
      { "name": "preview", "type": "Image", "required": false, "description": "Optional preview swatch image." }
    ],
    "preconditions": [],
    "effects": []
  },
  "scoring": {
    "determinism": "medium",
    "risk": "low",
    "reversible": true,
    "rationale": "Output is design-only; safe to regenerate and replace."
  },
  "dependencies": [],
  "governance": {
    "visibility": "org",
    "rbac": ["design.author"],
    "dataClassification": "internal",
    "cost": { "unit": "usd-per-1k-calls", "estimate": 0.4 },
    "audit": { "logged": true, "retentionDays": 30 }
  },
  "lifecycle": {
    "stage": "published",
    "certifiedBy": "coe.reviewer",
    "certifiedAt": "2026-06-29T10:00:00Z"
  }
}
